{"$schema":"https://json-schema.org/draft/2020-12/schema","$id":"https://thedailyline.bet/schemas/video/v1/caption-package.schema.json","title":"CaptionPackage","type":"object","additionalProperties":false,"required":["schema_version","caption_package_id","script_id","language","cues","created_at","caption_digest"],"properties":{"schema_version":{"const":"caption-package.v1"},"caption_package_id":{"$ref":"common.schema.json#/$defs/Id"},"script_id":{"$ref":"common.schema.json#/$defs/Ref"},"language":{"type":"string","minLength":2},"cues":{"type":"array","items":{"$ref":"#/$defs/CaptionCue"}},"created_at":{"$ref":"common.schema.json#/$defs/Timestamp"},"caption_digest":{"$ref":"common.schema.json#/$defs/Digest"}},"$defs":{"CaptionCue":{"type":"object","additionalProperties":false,"required":["cue_id","text","start_ms","end_ms","timestamp_ms","confidence","script_segment_ref","style_hint"],"properties":{"cue_id":{"$ref":"common.schema.json#/$defs/Id"},"text":{"type":"string","minLength":1},"start_ms":{"type":"integer","minimum":0},"end_ms":{"type":"integer","minimum":1},"timestamp_ms":{"type":["integer","null"],"minimum":0},"confidence":{"type":["string","null"],"pattern":"^(?:0(?:\\.[0-9]+)?|1(?:\\.0+)?)$"},"script_segment_ref":{"$ref":"common.schema.json#/$defs/Ref"},"style_hint":{"type":["string","null"]}}}}}
