{"schema_version":"caption-package.v1","caption_package_id":"captions.mlb.sf-lad.1a","script_id":"script.mlb.sf-lad.1a","language":"en-US","cues":[{"cue_id":"cue.1","text":"The model has San Francisco at 61.8% tonight.","start_ms":0,"end_ms":3000,"timestamp_ms":0,"confidence":"1.0","script_segment_ref":"seg.hook","style_hint":"kinetic"},{"cue_id":"cue.2","text":"That compares with a 54.2% market-implied probability.","start_ms":3000,"end_ms":8000,"timestamp_ms":3000,"confidence":"1.0","script_segment_ref":"seg.reason","style_hint":"kinetic"},{"cue_id":"cue.3","text":"The approved play is SF ML.","start_ms":8000,"end_ms":11500,"timestamp_ms":8000,"confidence":"1.0","script_segment_ref":"seg.pick","style_hint":"kinetic"},{"cue_id":"cue.4","text":"The Daily Line. See the data. Find the edge.","start_ms":11500,"end_ms":15000,"timestamp_ms":11500,"confidence":"1.0","script_segment_ref":"seg.outro","style_hint":"brand"}],"created_at":"2026-09-08T16:10:00Z","caption_digest":"sha256:b7984b93ebc7d22ca81b0a2b18f3c401ed5c2ca309e3ce47b1538f5f7888e7d4"}
